{
  "segment": "S01",
  "model": "seedance-2.5",
  "duration": 20,
  "prompt": "@图片1为人物参考（林小满，黑色低马尾；右眉一道小疤；瓜子脸；脸、发型、小特征和服装照此，忽略灰色背景）；@图片2为场景参考（布局、材质、颜色和光线照此，图中无人）：病房走廊；@音频1为林小满的音色参考（只取音色，不复用其中的话）；生成20秒视频。整体风格：真人剧质感，写实，电影机定焦镜头拍摄，光线来自场景里真实存在的光源；皮肤哑光、有毛孔，像上了一层薄粉，鼻头、额头、脸颊不反光、不油亮，无美颜，纹理不过度锐化；细腻的胶片颗粒。灯光只用场景内实际存在的光源（窗、灯具、屏幕、火），不加任何画面外补光、反光板或霓虹；摄影机从人物的阴影侧取景，脸由实景光勾出轮廓和眼神光；禁 3D 渲染感、禁游戏引擎质感、禁过饱和与 HDR 感。表演具体、真实：人物的内心想法要从眼神、呼吸和脸上的细微变化里看得见，强度跟着戏走，从完全静止到爆发都可以；不要空洞的眼神，不要舞台腔，不要过度表演；脸部清晰。本段结束时：输液管垂在地上滴，一小摊药水\n0-4.5秒：全景，正面，平视，固定机位，35mm，深景深。夜里的病房走廊，日光灯一盏接一盏向尽头排过去，塑胶地板反着冷白光。林小满抱着病历夹从尽头走来，边走边翻，脚步很轻。光来自头顶日光灯，顶光直落，越远越暗。\n4.5-8.5秒：中景，侧 45 度，平视，跟拍，50mm，浅景深。她边走边翻病历夹，走到护士站柜台旁脚步放慢，抬头。台灯的暖光打在她半边脸上。表情：0–1秒：瞳孔骤放，倒吸一口气；1–4秒：手指微颤，纸张滑落；节拍：① 翻页的手指停住；② 抬头前先屏了一下呼吸；③ 眼睛先于头转向七床方向。核心词：睁大眼睛、眼睛完全睁开。光来自台灯，左侧暖光，右脸留在日光灯冷光里。\n8.5-12秒：（再锚点：人物形象、服装与光源方向与开头一致）近景，侧 45 度，平视，推近，85mm，浅景深。她看向七床的门牌，门虚掩着一条缝，里面没有监护仪的滴滴声。她眉头一紧，上前半步。表情：0–2.3秒：眼圈以可见速度变红；2.3–3.5秒：闭眼，认了（台词落在这一段）；节拍：① 瞳孔先缩一下；② 嘴唇微张又合上；③ 喉结一次吞咽。核心词：睁大眼睛、眼睛完全睁开。光来自头顶日光灯，顶光，门缝里黑。林小满（音色：清而薄，略带鼻音，画内近场；语速：慢；语调：压低的问句；情感：不安；画内）：“七床？”\n12-17秒：中近景，侧面，平视，手持微晃，50mm，浅景深。她伸手推门，门缓缓开。病床空着，被子掀开一半，输液管垂到地上还在滴。她的手停在门把上。表情：0–3.3秒：眼圈以可见速度变红；3.3–5秒：闭眼，认了（台词落在这一段）；节拍：① 推门的手比平时慢；② 看见空床时没有后退，只是肩膀一沉；③ 第二句台词前一次短促的鼻吸。核心词：倒吸凉气、睁大双眼。光来自病房床头灯，门内暖光打在她脸上，身后走廊冷光。林小满（慌，但没有喊出来）：“七床的人呢？”\n17-20秒：特写，正面，微俯，固定机位，85mm，浅景深。输液管末端一滴药水落到地板上，积成一小摊，映着床头灯。画面里没有人。光来自病房床头灯，侧光，地板反光。\n声音：日光灯的嗡声；很轻的脚步；翻页声；远处别的病房监护仪很弱的滴滴声；门轴很轻的吱呀；输液滴落声；滴落声；输液滴落的间隔很规律；不要背景音乐和配乐。\n⚠️插入镜头的焦点落在道具与手上，不漂到背景。\n⚠️道具位置与状态按描述固定，不凭空出现或消失，不复制成多件。\n⚠️除参考里已有的字外不出现任何可读文字、字幕、水印。\n约束：人物与参考一致、场景连续、光源方向不变、口型与台词同步、无字幕、无水印、除参考里已有的字外不出现可读文字。",
  "files": [
    {
      "file": "素材库/人物/林小满_特写.png",
      "tag": "@图片1",
      "role": "identity"
    },
    {
      "file": "素材库/场景/病房走廊_夜_空景.png",
      "tag": "@图片2",
      "role": "location"
    },
    {
      "file": "素材库/声音/林小满.wav",
      "tag": "@音频1",
      "role": "voice"
    }
  ],
  "chars": 1489,
  "warnings": [
    "⚠️插入镜头的焦点落在道具与手上，不漂到背景。",
    "⚠️道具位置与状态按描述固定，不凭空出现或消失，不复制成多件。",
    "⚠️除参考里已有的字外不出现任何可读文字、字幕、水印。"
  ],
  "issues": [],
  "paste": "@图片1为人物参考（林小满，黑色低马尾；右眉一道小疤；瓜子脸；脸、发型、小特征和服装照此，忽略灰色背景）；@图片2为场景参考（布局、材质、颜色和光线照此，图中无人）：病房走廊；@音频1为林小满的音色参考（只取音色，不复用其中的话）；生成20秒视频。整体风格：真人剧质感，写实，电影机定焦镜头拍摄，光线来自场景里真实存在的光源；皮肤哑光、有毛孔，像上了一层薄粉，鼻头、额头、脸颊不反光、不油亮，无美颜，纹理不过度锐化；细腻的胶片颗粒。灯光只用场景内实际存在的光源（窗、灯具、屏幕、火），不加任何画面外补光、反光板或霓虹；摄影机从人物的阴影侧取景，脸由实景光勾出轮廓和眼神光；禁 3D 渲染感、禁游戏引擎质感、禁过饱和与 HDR 感。表演具体、真实：人物的内心想法要从眼神、呼吸和脸上的细微变化里看得见，强度跟着戏走，从完全静止到爆发都可以；不要空洞的眼神，不要舞台腔，不要过度表演；脸部清晰。本段结束时：输液管垂在地上滴，一小摊药水\n0-4.5秒：全景，正面，平视，固定机位，35mm，深景深。夜里的病房走廊，日光灯一盏接一盏向尽头排过去，塑胶地板反着冷白光。林小满抱着病历夹从尽头走来，边走边翻，脚步很轻。光来自头顶日光灯，顶光直落，越远越暗。\n4.5-8.5秒：中景，侧 45 度，平视，跟拍，50mm，浅景深。她边走边翻病历夹，走到护士站柜台旁脚步放慢，抬头。台灯的暖光打在她半边脸上。表情：0–1秒：瞳孔骤放，倒吸一口气；1–4秒：手指微颤，纸张滑落；节拍：① 翻页的手指停住；② 抬头前先屏了一下呼吸；③ 眼睛先于头转向七床方向。核心词：睁大眼睛、眼睛完全睁开。光来自台灯，左侧暖光，右脸留在日光灯冷光里。\n8.5-12秒：（再锚点：人物形象、服装与光源方向与开头一致）近景，侧 45 度，平视，推近，85mm，浅景深。她看向七床的门牌，门虚掩着一条缝，里面没有监护仪的滴滴声。她眉头一紧，上前半步。表情：0–2.3秒：眼圈以可见速度变红；2.3–3.5秒：闭眼，认了（台词落在这一段）；节拍：① 瞳孔先缩一下；② 嘴唇微张又合上；③ 喉结一次吞咽。核心词：睁大眼睛、眼睛完全睁开。光来自头顶日光灯，顶光，门缝里黑。林小满（音色：清而薄，略带鼻音，画内近场；语速：慢；语调：压低的问句；情感：不安；画内）：“七床？”\n12-17秒：中近景，侧面，平视，手持微晃，50mm，浅景深。她伸手推门，门缓缓开。病床空着，被子掀开一半，输液管垂到地上还在滴。她的手停在门把上。表情：0–3.3秒：眼圈以可见速度变红；3.3–5秒：闭眼，认了（台词落在这一段）；节拍：① 推门的手比平时慢；② 看见空床时没有后退，只是肩膀一沉；③ 第二句台词前一次短促的鼻吸。核心词：倒吸凉气、睁大双眼。光来自病房床头灯，门内暖光打在她脸上，身后走廊冷光。林小满（慌，但没有喊出来）：“七床的人呢？”\n17-20秒：特写，正面，微俯，固定机位，85mm，浅景深。输液管末端一滴药水落到地板上，积成一小摊，映着床头灯。画面里没有人。光来自病房床头灯，侧光，地板反光。\n声音：日光灯的嗡声；很轻的脚步；翻页声；远处别的病房监护仪很弱的滴滴声；门轴很轻的吱呀；输液滴落声；滴落声；输液滴落的间隔很规律；不要背景音乐和配乐。\n⚠️插入镜头的焦点落在道具与手上，不漂到背景。\n⚠️道具位置与状态按描述固定，不凭空出现或消失，不复制成多件。\n⚠️除参考里已有的字外不出现任何可读文字、字幕、水印。\n约束：人物与参考一致、场景连续、光源方向不变、口型与台词同步、无字幕、无水印、除参考里已有的字外不出现可读文字。\n\n【上传素材，按编号顺序】@图片1 ← 素材库/人物/林小满_特写.png（identity）；@图片2 ← 素材库/场景/病房走廊_夜_空景.png（location）；@音频1 ← 素材库/声音/林小满.wav（voice）\n【时长】20 秒"
}