{
  "segment": "S03",
  "model": "seedance-2.5",
  "duration": 15,
  "prompt": "@图片1为人物参考（林小满，黑色低马尾；右眉一道小疤；瓜子脸；脸、发型、小特征和服装照此，忽略灰色背景）；@图片2为人物参考（周岸，寸头；方下巴；左耳后一颗痣；脸、发型、小特征和服装照此，忽略灰色背景）；@图片3为场景参考（布局、材质、颜色和光线照此，图中无人）：电梯口；@图片4为这一机位身后的背景：电梯口，A 侧机位身后；@图片5为这一机位身后的背景：电梯口，B 侧机位身后；@音频1为林小满的音色参考（只取音色，不复用其中的话）；@音频2为周岸的音色参考（只取音色，不复用其中的话）；生成15秒视频。整体风格：真人剧质感，写实，电影机定焦镜头拍摄，光线来自场景里真实存在的光源；皮肤哑光、有毛孔，像上了一层薄粉，鼻头、额头、脸颊不反光、不油亮，无美颜，纹理不过度锐化；细腻的胶片颗粒。灯光只用场景内实际存在的光源（窗、灯具、屏幕、火），不加任何画面外补光、反光板或霓虹；摄影机从人物的阴影侧取景，脸由实景光勾出轮廓和眼神光；禁 3D 渲染感、禁游戏引擎质感、禁过饱和与 HDR 感。表演具体、真实：人物的内心想法要从眼神、呼吸和脸上的细微变化里看得见，强度跟着戏走，从完全静止到爆发都可以；不要空洞的眼神，不要舞台腔，不要过度表演；脸部清晰。承接上一段（S02）结尾：周岸上前半步，右手搭在夹克口袋外；人物形象、服装、光源方向与上一段完全一致。本段结束时：周岸拉下袖口盖住手腕，抬头看林小满；视线：周岸面向画面左；林小满背对镜头\n0-2.5秒：特写，正面，微俯，焦点转换，85mm。周岸垂下的右手，手腕内侧一块留置针贴膏，边角翘起一点，胶布下压着一小截软管；夹克袖口往上缩了一寸。画面只有手和袖口。光来自头顶闪烁的日光灯，顶光。\n2.5-6秒：全景，侧面，平视，固定机位，35mm，深景深。侧面双人全景：电梯门在周岸身后合上，不锈钢门面映出两人的影子。头顶那盏灯闪了一下，暗下去再亮起来。两人隔着三步没动。光来自头顶闪烁的日光灯，顶光闪烁，门面反光。\n6-11秒：中景，侧 45 度，平视，手持微晃，50mm，浅景深。林小满把病历夹抱紧，上前一步又停住，下巴抬起来，说话时眼睛看的是他的手腕而不是脸。表情：0–1.7秒：瞳孔骤然放大，眼底怒意像困兽；1.7–3.3秒：下唇紧咬泛白，怒意从眼底渗出（台词落在这一段）；3.3–5秒：眼眶红到极致，呼吸急促可见白雾；幅度压到最小，藏七露三；节拍：① 下巴抬起是职业姿态；② 眼睛落在他手腕；③ 第二句说完才敢看他的脸。核心词：冷酷的注视、冰冷的怒视。光来自头顶闪烁的日光灯，顶光。林小满（护士口气，快而硬，尾音发颤）：“回去躺着。你的输液还没拔。”\n11-15秒：近景，侧 45 度，平视，推近，85mm，浅景深。周岸低头看了一眼自己的手腕，再抬头，把袖口往下拉盖住贴膏。表演：① 低头看手腕时嘴角压平；② 拉袖口的动作很慢；③ 抬头时眼睛直接锁住她。光来自电梯指示灯，红光在他左颊，顶光稳定下来。周岸（平静，每个字都慢半拍）：“我不是来住院的。”\n声音：日光灯镇流器的滋滋声（与上一段相同、不中断）；电梯门合上的闷响；镇流器滋滋声突然大了一下又恢复；镇流器滋滋声；袖口布料摩擦；不要背景音乐和配乐。\n⚠️人物面部、发型、小特征与服装全程与人物参考一致，不随景别和光线变化。\n⚠️插入镜头的焦点落在道具与手上，不漂到背景。\n⚠️屏幕、灯具只作为画面里发光的物件，不向人物皮肤与服装投射大面积色光。\n约束：人物与参考一致、场景连续、光源方向不变、口型与台词同步、无字幕、无水印、除参考里已有的字外不出现可读文字。",
  "files": [
    {
      "file": "素材库/人物/林小满_特写.png",
      "tag": "@图片1",
      "role": "identity"
    },
    {
      "file": "素材库/人物/周岸_特写.png",
      "tag": "@图片2",
      "role": "identity"
    },
    {
      "file": "素材库/场景/电梯口_夜_空景.png",
      "tag": "@图片3",
      "role": "location"
    },
    {
      "file": "素材库/场景/电梯口_夜_A侧.png",
      "tag": "@图片4",
      "role": "plate"
    },
    {
      "file": "素材库/场景/电梯口_夜_B侧.png",
      "tag": "@图片5",
      "role": "plate"
    },
    {
      "file": "素材库/声音/林小满.wav",
      "tag": "@音频1",
      "role": "voice"
    },
    {
      "file": "素材库/声音/周岸.wav",
      "tag": "@音频2",
      "role": "voice"
    }
  ],
  "chars": 1481,
  "warnings": [
    "⚠️人物面部、发型、小特征与服装全程与人物参考一致，不随景别和光线变化。",
    "⚠️插入镜头的焦点落在道具与手上，不漂到背景。",
    "⚠️屏幕、灯具只作为画面里发光的物件，不向人物皮肤与服装投射大面积色光。"
  ],
  "issues": [],
  "paste": "@图片1为人物参考（林小满，黑色低马尾；右眉一道小疤；瓜子脸；脸、发型、小特征和服装照此，忽略灰色背景）；@图片2为人物参考（周岸，寸头；方下巴；左耳后一颗痣；脸、发型、小特征和服装照此，忽略灰色背景）；@图片3为场景参考（布局、材质、颜色和光线照此，图中无人）：电梯口；@图片4为这一机位身后的背景：电梯口，A 侧机位身后；@图片5为这一机位身后的背景：电梯口，B 侧机位身后；@音频1为林小满的音色参考（只取音色，不复用其中的话）；@音频2为周岸的音色参考（只取音色，不复用其中的话）；生成15秒视频。整体风格：真人剧质感，写实，电影机定焦镜头拍摄，光线来自场景里真实存在的光源；皮肤哑光、有毛孔，像上了一层薄粉，鼻头、额头、脸颊不反光、不油亮，无美颜，纹理不过度锐化；细腻的胶片颗粒。灯光只用场景内实际存在的光源（窗、灯具、屏幕、火），不加任何画面外补光、反光板或霓虹；摄影机从人物的阴影侧取景，脸由实景光勾出轮廓和眼神光；禁 3D 渲染感、禁游戏引擎质感、禁过饱和与 HDR 感。表演具体、真实：人物的内心想法要从眼神、呼吸和脸上的细微变化里看得见，强度跟着戏走，从完全静止到爆发都可以；不要空洞的眼神，不要舞台腔，不要过度表演；脸部清晰。承接上一段（S02）结尾：周岸上前半步，右手搭在夹克口袋外；人物形象、服装、光源方向与上一段完全一致。本段结束时：周岸拉下袖口盖住手腕，抬头看林小满；视线：周岸面向画面左；林小满背对镜头\n0-2.5秒：特写，正面，微俯，焦点转换，85mm。周岸垂下的右手，手腕内侧一块留置针贴膏，边角翘起一点，胶布下压着一小截软管；夹克袖口往上缩了一寸。画面只有手和袖口。光来自头顶闪烁的日光灯，顶光。\n2.5-6秒：全景，侧面，平视，固定机位，35mm，深景深。侧面双人全景：电梯门在周岸身后合上，不锈钢门面映出两人的影子。头顶那盏灯闪了一下，暗下去再亮起来。两人隔着三步没动。光来自头顶闪烁的日光灯，顶光闪烁，门面反光。\n6-11秒：中景，侧 45 度，平视，手持微晃，50mm，浅景深。林小满把病历夹抱紧，上前一步又停住，下巴抬起来，说话时眼睛看的是他的手腕而不是脸。表情：0–1.7秒：瞳孔骤然放大，眼底怒意像困兽；1.7–3.3秒：下唇紧咬泛白，怒意从眼底渗出（台词落在这一段）；3.3–5秒：眼眶红到极致，呼吸急促可见白雾；幅度压到最小，藏七露三；节拍：① 下巴抬起是职业姿态；② 眼睛落在他手腕；③ 第二句说完才敢看他的脸。核心词：冷酷的注视、冰冷的怒视。光来自头顶闪烁的日光灯，顶光。林小满（护士口气，快而硬，尾音发颤）：“回去躺着。你的输液还没拔。”\n11-15秒：近景，侧 45 度，平视，推近，85mm，浅景深。周岸低头看了一眼自己的手腕，再抬头，把袖口往下拉盖住贴膏。表演：① 低头看手腕时嘴角压平；② 拉袖口的动作很慢；③ 抬头时眼睛直接锁住她。光来自电梯指示灯，红光在他左颊，顶光稳定下来。周岸（平静，每个字都慢半拍）：“我不是来住院的。”\n声音：日光灯镇流器的滋滋声（与上一段相同、不中断）；电梯门合上的闷响；镇流器滋滋声突然大了一下又恢复；镇流器滋滋声；袖口布料摩擦；不要背景音乐和配乐。\n⚠️人物面部、发型、小特征与服装全程与人物参考一致，不随景别和光线变化。\n⚠️插入镜头的焦点落在道具与手上，不漂到背景。\n⚠️屏幕、灯具只作为画面里发光的物件，不向人物皮肤与服装投射大面积色光。\n约束：人物与参考一致、场景连续、光源方向不变、口型与台词同步、无字幕、无水印、除参考里已有的字外不出现可读文字。\n\n【上传素材，按编号顺序】@图片1 ← 素材库/人物/林小满_特写.png（identity）；@图片2 ← 素材库/人物/周岸_特写.png（identity）；@图片3 ← 素材库/场景/电梯口_夜_空景.png（location）；@图片4 ← 素材库/场景/电梯口_夜_A侧.png（plate）；@图片5 ← 素材库/场景/电梯口_夜_B侧.png（plate）；@音频1 ← 素材库/声音/林小满.wav（voice）；@音频2 ← 素材库/声音/周岸.wav（voice）\n【时长】15 秒"
}