{
  "segment": "S04",
  "model": "seedance-2.5",
  "duration": 14,
  "prompt": "@图片1为人物参考（黑衣男，黑色连帽衫兜帽压低；黑口罩；右手背刺青；脸、发型、小特征和服装照此，忽略灰色背景）；@图片2为人物参考（周岸，寸头；方下巴；左耳后一颗痣；脸、发型、小特征和服装照此，忽略灰色背景）；@图片3为人物参考（林小满，黑色低马尾；右眉一道小疤；瓜子脸；脸、发型、小特征和服装照此，忽略灰色背景）；@图片4为场景参考（布局、材质、颜色和光线照此，图中无人）：电梯口；@图片5为道具参考：折叠刀（E01S03B04）；@音频1为周岸的音色参考（只取音色，不复用其中的话）；生成14秒视频。整体风格：真人剧质感，写实，电影机定焦镜头拍摄，光线来自场景里真实存在的光源；皮肤哑光、有毛孔，像上了一层薄粉，鼻头、额头、脸颊不反光、不油亮，无美颜，纹理不过度锐化；细腻的胶片颗粒。灯光只用场景内实际存在的光源（窗、灯具、屏幕、火），不加任何画面外补光、反光板或霓虹；摄影机从人物的阴影侧取景，脸由实景光勾出轮廓和眼神光；禁 3D 渲染感、禁游戏引擎质感、禁过饱和与 HDR 感。表演具体、真实：人物的内心想法要从眼神、呼吸和脸上的细微变化里看得见，强度跟着戏走，从完全静止到爆发都可以；不要空洞的眼神，不要舞台腔，不要过度表演；脸部清晰。本段结束时：防火门晃着；周岸回头面向林小满，左袖口裂开；视线：黑衣男退回楼梯间；周岸：回头面向林小满（画面左）；林小满面向周岸\n0-2.5秒：中全景，侧 45 度，平视，手持晃动，35mm，深景深。楼梯间防火门被撞开，黑衣男冲出来，兜帽压低，右手一把折叠刀，三步直奔周岸。周岸转身。光来自头顶日光灯，顶光，防火门内是黑的。动作：黑衣男发起，从防火门直线冲刺两米，打向周岸；对方周岸听声转身，重心下沉；没有接触；结束在：黑衣男一步之外举刀，周岸侧身。流派：匕首/短刀。\n2.5-5秒：中景，侧 45 度，平视，手持剧烈晃动，35mm，深景深。周岸左手把林小满往身后一拨，右脚撤步侧身，第一刀贴着他胸口划过，刀尖挑开夹克左袖口。动作模式·打斗：节奏：快慢结合，有打击停顿感。此刻人物状态：周岸左袖口被划开。光来自头顶日光灯，顶光。动作：黑衣男发起，正手横划，自右向左，打向周岸胸口；对方周岸撤步侧身让开，左臂护人；擦过；刀尖带起夹克袖口布料；结束在：周岸侧身，左袖口裂开；黑衣男刀势用老、身体前倾。流派：中线理论、匕首/短刀。\n5-7.5秒：近景，侧 45 度，平视，手持剧烈晃动，50mm，浅景深。黑衣男第二刀直刺，周岸右前臂格开他持刀的手腕，左膝顶上去，刀从他手里脱出砸在地板上。此刻人物状态：周岸左袖口被划开。光来自头顶日光灯，顶光。动作：黑衣男发起，直刺腹部，打向周岸腹部；对方周岸前臂外格手腕，顺势膝顶；命中；黑衣男上身折起，刀脱手；结束在：黑衣男弯腰后退一步；周岸收膝站稳。流派：中线理论。\n7.5-9.5秒：特写，正面，俯拍，固定机位，85mm，浅景深。折叠刀在浅绿塑胶地板上转了半圈停下，刀刃朝向防火门。画面里只有刀和地板的反光。光来自头顶日光灯，顶光，地板反光。动作：刀落地旋转；没有接触；结束在：刀静止。\n9.5-14秒：中景，侧 45 度，平视，手持微晃，50mm，浅景深。黑衣男退回楼梯间，防火门弹回来晃着。周岸没有追，回头看林小满，左袖口裂着，呼吸还没平。动作模式·转身回头：战斗后回头：发丝凌乱，眼神凌厉。表情：0–2秒：笑意从眼底层层漫上；2–4秒：胜券在握的从容（台词落在这一段）；幅度压到最小，藏七露三；节拍：① 回头前先吐了一口气；② 说话时眉毛没动，只有嘴角；③ 视线落在她抱着的病历夹上。核心词：温和的微笑、柔和的笑容。此刻人物状态：周岸左袖口被划开。光来自头顶日光灯，顶光；防火门晃动时门内一道黑影来回。动作：黑衣男发起，后退两步进门；对方周岸不追，回头；没有接触；结束在：黑衣男消失在门后；周岸回头。周岸（喘着，低，像在笑又不是）：“现在信了？”\n声音：防火门撞墙的巨响；急促脚步；布料撕裂声；刀锋破空；前臂撞击的闷响；金属刀落地的脆响；刀在地板上转动的刮擦声停下；防火门来回晃的吱呀；两人的呼吸；不要背景音乐和配乐。\n⚠️大动作（走路、起身、转身）完整、连贯、重心真实，不穿模、不多出肢体。\n⚠️人物面部、发型、小特征与服装全程与人物参考一致，不随景别和光线变化。\n⚠️插入镜头的焦点落在道具与手上，不漂到背景。\n⚠️肢体结构正确：五指清晰、关节不畸形、身体不僵硬、不扭曲。\n⚠️武器、头发、身体不穿模，膝盖不穿透地面，身体不互相穿透。\n⚠️河流、墙、门、车辆等阻隔物的另一侧没有人，除非描述里写了。\n⚠️动作符合物理：脚踏实地、不同手同脚、重心真实、步伐不僵硬。\n⚠️道具位置与状态按描述固定，不凭空出现或消失，不复制成多件。\n约束：人物与参考一致、场景连续、光源方向不变、口型与台词同步、无字幕、无水印、除参考里已有的字外不出现可读文字。",
  "files": [
    {
      "file": "素材库/人物/黑衣男_全身正面.png",
      "tag": "@图片1",
      "role": "identity"
    },
    {
      "file": "素材库/人物/周岸_特写.png",
      "tag": "@图片2",
      "role": "identity"
    },
    {
      "file": "素材库/人物/林小满_全身正面.png",
      "tag": "@图片3",
      "role": "identity"
    },
    {
      "file": "素材库/场景/电梯口_夜_空景.png",
      "tag": "@图片4",
      "role": "location"
    },
    {
      "file": "素材库/道具/折叠刀_地上.png",
      "tag": "@图片5",
      "role": "prop"
    },
    {
      "file": "素材库/声音/周岸.wav",
      "tag": "@音频1",
      "role": "voice"
    }
  ],
  "chars": 2015,
  "warnings": [
    "⚠️大动作（走路、起身、转身）完整、连贯、重心真实，不穿模、不多出肢体。",
    "⚠️人物面部、发型、小特征与服装全程与人物参考一致，不随景别和光线变化。",
    "⚠️插入镜头的焦点落在道具与手上，不漂到背景。",
    "⚠️肢体结构正确：五指清晰、关节不畸形、身体不僵硬、不扭曲。",
    "⚠️武器、头发、身体不穿模，膝盖不穿透地面，身体不互相穿透。",
    "⚠️河流、墙、门、车辆等阻隔物的另一侧没有人，除非描述里写了。",
    "⚠️动作符合物理：脚踏实地、不同手同脚、重心真实、步伐不僵硬。",
    "⚠️道具位置与状态按描述固定，不凭空出现或消失，不复制成多件。"
  ],
  "issues": [],
  "paste": "@图片1为人物参考（黑衣男，黑色连帽衫兜帽压低；黑口罩；右手背刺青；脸、发型、小特征和服装照此，忽略灰色背景）；@图片2为人物参考（周岸，寸头；方下巴；左耳后一颗痣；脸、发型、小特征和服装照此，忽略灰色背景）；@图片3为人物参考（林小满，黑色低马尾；右眉一道小疤；瓜子脸；脸、发型、小特征和服装照此，忽略灰色背景）；@图片4为场景参考（布局、材质、颜色和光线照此，图中无人）：电梯口；@图片5为道具参考：折叠刀（E01S03B04）；@音频1为周岸的音色参考（只取音色，不复用其中的话）；生成14秒视频。整体风格：真人剧质感，写实，电影机定焦镜头拍摄，光线来自场景里真实存在的光源；皮肤哑光、有毛孔，像上了一层薄粉，鼻头、额头、脸颊不反光、不油亮，无美颜，纹理不过度锐化；细腻的胶片颗粒。灯光只用场景内实际存在的光源（窗、灯具、屏幕、火），不加任何画面外补光、反光板或霓虹；摄影机从人物的阴影侧取景，脸由实景光勾出轮廓和眼神光；禁 3D 渲染感、禁游戏引擎质感、禁过饱和与 HDR 感。表演具体、真实：人物的内心想法要从眼神、呼吸和脸上的细微变化里看得见，强度跟着戏走，从完全静止到爆发都可以；不要空洞的眼神，不要舞台腔，不要过度表演；脸部清晰。本段结束时：防火门晃着；周岸回头面向林小满，左袖口裂开；视线：黑衣男退回楼梯间；周岸：回头面向林小满（画面左）；林小满面向周岸\n0-2.5秒：中全景，侧 45 度，平视，手持晃动，35mm，深景深。楼梯间防火门被撞开，黑衣男冲出来，兜帽压低，右手一把折叠刀，三步直奔周岸。周岸转身。光来自头顶日光灯，顶光，防火门内是黑的。动作：黑衣男发起，从防火门直线冲刺两米，打向周岸；对方周岸听声转身，重心下沉；没有接触；结束在：黑衣男一步之外举刀，周岸侧身。流派：匕首/短刀。\n2.5-5秒：中景，侧 45 度，平视，手持剧烈晃动，35mm，深景深。周岸左手把林小满往身后一拨，右脚撤步侧身，第一刀贴着他胸口划过，刀尖挑开夹克左袖口。动作模式·打斗：节奏：快慢结合，有打击停顿感。此刻人物状态：周岸左袖口被划开。光来自头顶日光灯，顶光。动作：黑衣男发起，正手横划，自右向左，打向周岸胸口；对方周岸撤步侧身让开，左臂护人；擦过；刀尖带起夹克袖口布料；结束在：周岸侧身，左袖口裂开；黑衣男刀势用老、身体前倾。流派：中线理论、匕首/短刀。\n5-7.5秒：近景，侧 45 度，平视，手持剧烈晃动，50mm，浅景深。黑衣男第二刀直刺，周岸右前臂格开他持刀的手腕，左膝顶上去，刀从他手里脱出砸在地板上。此刻人物状态：周岸左袖口被划开。光来自头顶日光灯，顶光。动作：黑衣男发起，直刺腹部，打向周岸腹部；对方周岸前臂外格手腕，顺势膝顶；命中；黑衣男上身折起，刀脱手；结束在：黑衣男弯腰后退一步；周岸收膝站稳。流派：中线理论。\n7.5-9.5秒：特写，正面，俯拍，固定机位，85mm，浅景深。折叠刀在浅绿塑胶地板上转了半圈停下，刀刃朝向防火门。画面里只有刀和地板的反光。光来自头顶日光灯，顶光，地板反光。动作：刀落地旋转；没有接触；结束在：刀静止。\n9.5-14秒：中景，侧 45 度，平视，手持微晃，50mm，浅景深。黑衣男退回楼梯间，防火门弹回来晃着。周岸没有追，回头看林小满，左袖口裂着，呼吸还没平。动作模式·转身回头：战斗后回头：发丝凌乱，眼神凌厉。表情：0–2秒：笑意从眼底层层漫上；2–4秒：胜券在握的从容（台词落在这一段）；幅度压到最小，藏七露三；节拍：① 回头前先吐了一口气；② 说话时眉毛没动，只有嘴角；③ 视线落在她抱着的病历夹上。核心词：温和的微笑、柔和的笑容。此刻人物状态：周岸左袖口被划开。光来自头顶日光灯，顶光；防火门晃动时门内一道黑影来回。动作：黑衣男发起，后退两步进门；对方周岸不追，回头；没有接触；结束在：黑衣男消失在门后；周岸回头。周岸（喘着，低，像在笑又不是）：“现在信了？”\n声音：防火门撞墙的巨响；急促脚步；布料撕裂声；刀锋破空；前臂撞击的闷响；金属刀落地的脆响；刀在地板上转动的刮擦声停下；防火门来回晃的吱呀；两人的呼吸；不要背景音乐和配乐。\n⚠️大动作（走路、起身、转身）完整、连贯、重心真实，不穿模、不多出肢体。\n⚠️人物面部、发型、小特征与服装全程与人物参考一致，不随景别和光线变化。\n⚠️插入镜头的焦点落在道具与手上，不漂到背景。\n⚠️肢体结构正确：五指清晰、关节不畸形、身体不僵硬、不扭曲。\n⚠️武器、头发、身体不穿模，膝盖不穿透地面，身体不互相穿透。\n⚠️河流、墙、门、车辆等阻隔物的另一侧没有人，除非描述里写了。\n⚠️动作符合物理：脚踏实地、不同手同脚、重心真实、步伐不僵硬。\n⚠️道具位置与状态按描述固定，不凭空出现或消失，不复制成多件。\n约束：人物与参考一致、场景连续、光源方向不变、口型与台词同步、无字幕、无水印、除参考里已有的字外不出现可读文字。\n\n【上传素材，按编号顺序】@图片1 ← 素材库/人物/黑衣男_全身正面.png（identity）；@图片2 ← 素材库/人物/周岸_特写.png（identity）；@图片3 ← 素材库/人物/林小满_全身正面.png（identity）；@图片4 ← 素材库/场景/电梯口_夜_空景.png（location）；@图片5 ← 素材库/道具/折叠刀_地上.png（prop）；@音频1 ← 素材库/声音/周岸.wav（voice）\n【时长】14 秒"
}