{
  "segment": "S02",
  "model": "seedance-2.5",
  "duration": 16,
  "prompt": "@图片1为人物参考（林小满，黑色低马尾；右眉一道小疤；瓜子脸；脸、发型、小特征和服装照此，忽略灰色背景）；@图片2为人物参考（周岸，寸头；方下巴；左耳后一颗痣；脸、发型、小特征和服装照此，忽略灰色背景）；@图片3为场景参考（布局、材质、颜色和光线照此，图中无人）：电梯口；@图片4为这一机位身后的背景：电梯口，A 侧机位身后；@图片5为这一机位身后的背景：电梯口，B 侧机位身后；@音频1为周岸的音色参考（只取音色，不复用其中的话）；@音频2为林小满的音色参考（只取音色，不复用其中的话）；生成16秒视频。整体风格：真人剧质感，写实，电影机定焦镜头拍摄，光线来自场景里真实存在的光源；皮肤哑光、有毛孔，像上了一层薄粉，鼻头、额头、脸颊不反光、不油亮，无美颜，纹理不过度锐化；细腻的胶片颗粒。灯光只用场景内实际存在的光源（窗、灯具、屏幕、火），不加任何画面外补光、反光板或霓虹；摄影机从人物的阴影侧取景，脸由实景光勾出轮廓和眼神光；禁 3D 渲染感、禁游戏引擎质感、禁过饱和与 HDR 感。表演具体、真实：人物的内心想法要从眼神、呼吸和脸上的细微变化里看得见，强度跟着戏走，从完全静止到爆发都可以；不要空洞的眼神，不要舞台腔，不要过度表演；脸部清晰。本段结束时：周岸上前半步，右手搭在夹克口袋外；视线：周岸面向画面左；林小满背对镜头\n0-5秒：全景，侧 45 度，平视，跟拍，手持晃动，35mm，深景深。林小满小跑到走廊尽头，电梯门正在合上，一只手从里面把门挡住。周岸从电梯里走出来，病号服外套着黑夹克，拖鞋踩在地板上。表演：① 她刹住脚时病历夹差点掉；② 周岸出电梯的第一步很稳，第二步才看见她。光来自头顶闪烁的日光灯，顶光忽明忽暗；电梯指示灯红光在他侧脸。主光：头顶闪烁的日光灯，顶光直落；辅光：浅绿塑胶地板反射，极弱；轮廓光：电梯指示灯红光勾周岸侧脸；光比：6:1；色温：4500K 冷白；指示灯 1800K 红；阴影：眼窝与鼻下硬影，随闪烁跳动；曝光：脸正常，走廊深处欠两档；光线变化：日光灯每 1 秒闪一次。\n5-8秒：中近景，侧 45 度，平视，过肩，手持微晃，50mm，浅景深。过林小满的肩看周岸。他把手从电梯门上收回来，没有往前走，只是看着她。表演：① 下颌微抬；② 缓慢均匀的一次眨眼；③ 说话前嘴角先松了一下。光来自电梯指示灯，红光在他左颊，顶光闪烁。周岸（音色：低、沉、颗粒感，画内近场；语速：慢半拍；语调：低平陈述；情感：确认而非打招呼；画内）：“小满。”\n8-12秒：（再锚点：人物形象、服装与光源方向与开头一致）近景，侧 45 度，平视，推近，85mm，浅景深。林小满停住，把病历夹抱紧贴到胸口。她的视线先落在他夹克里露出的病号服条纹上，再回到他脸上。表情：0–1.3秒：嘴唇微张，恍惚如在梦中；1.3–2.7秒：涣散目光突然收拢聚焦，睫毛轻颤（台词落在这一段）；2.7–4秒：下巴绷紧，咬唇强行忍住；节拍：① 身体冻住 0.3 秒；② 视线从病号服往上扫到脸；③ 问话前咬了一下下唇内侧。核心词：缓慢地舔嘴唇、饥饿或期待的眼神。光来自头顶闪烁的日光灯，顶光，闪一下她的脸亮一下。林小满（音色：清而薄，略带鼻音，画内近场；语速：快；语调：问句上扬；情感：发紧；画内）：“你是七床？”\n12-16秒：中近景，侧 45 度，微仰，手持微晃，50mm，浅景深。周岸上前半步又停住，右手在夹克口袋外面按了一下，像确认什么东西还在。表演：① 上前半步时重心先动再迈脚；② 按口袋的手指停了一拍；③ 说话时视线没离开她。光来自电梯指示灯，红光在他左颊。周岸（轻，带一点笑意但不是开玩笑）：“我以为你早换科室了。”\n声音：跑步声刹住；电梯门被手挡住的闷响；日光灯镇流器的滋滋声；拖鞋在地板上蹭了一下；不要背景音乐和配乐。\n⚠️人物面部、发型、小特征与服装全程与人物参考一致，不随景别和光线变化。\n⚠️屏幕、灯具只作为画面里发光的物件，不向人物皮肤与服装投射大面积色光。\n约束：人物与参考一致、场景连续、光源方向不变、口型与台词同步、无字幕、无水印、除参考里已有的字外不出现可读文字。",
  "files": [
    {
      "file": "素材库/人物/林小满_特写.png",
      "tag": "@图片1",
      "role": "identity"
    },
    {
      "file": "素材库/人物/周岸_特写.png",
      "tag": "@图片2",
      "role": "identity"
    },
    {
      "file": "素材库/场景/电梯口_夜_空景.png",
      "tag": "@图片3",
      "role": "location"
    },
    {
      "file": "素材库/场景/电梯口_夜_A侧.png",
      "tag": "@图片4",
      "role": "plate"
    },
    {
      "file": "素材库/场景/电梯口_夜_B侧.png",
      "tag": "@图片5",
      "role": "plate"
    },
    {
      "file": "素材库/声音/周岸.wav",
      "tag": "@音频1",
      "role": "voice"
    },
    {
      "file": "素材库/声音/林小满.wav",
      "tag": "@音频2",
      "role": "voice"
    }
  ],
  "chars": 1697,
  "warnings": [
    "⚠️人物面部、发型、小特征与服装全程与人物参考一致，不随景别和光线变化。",
    "⚠️屏幕、灯具只作为画面里发光的物件，不向人物皮肤与服装投射大面积色光。"
  ],
  "issues": [],
  "paste": "@图片1为人物参考（林小满，黑色低马尾；右眉一道小疤；瓜子脸；脸、发型、小特征和服装照此，忽略灰色背景）；@图片2为人物参考（周岸，寸头；方下巴；左耳后一颗痣；脸、发型、小特征和服装照此，忽略灰色背景）；@图片3为场景参考（布局、材质、颜色和光线照此，图中无人）：电梯口；@图片4为这一机位身后的背景：电梯口，A 侧机位身后；@图片5为这一机位身后的背景：电梯口，B 侧机位身后；@音频1为周岸的音色参考（只取音色，不复用其中的话）；@音频2为林小满的音色参考（只取音色，不复用其中的话）；生成16秒视频。整体风格：真人剧质感，写实，电影机定焦镜头拍摄，光线来自场景里真实存在的光源；皮肤哑光、有毛孔，像上了一层薄粉，鼻头、额头、脸颊不反光、不油亮，无美颜，纹理不过度锐化；细腻的胶片颗粒。灯光只用场景内实际存在的光源（窗、灯具、屏幕、火），不加任何画面外补光、反光板或霓虹；摄影机从人物的阴影侧取景，脸由实景光勾出轮廓和眼神光；禁 3D 渲染感、禁游戏引擎质感、禁过饱和与 HDR 感。表演具体、真实：人物的内心想法要从眼神、呼吸和脸上的细微变化里看得见，强度跟着戏走，从完全静止到爆发都可以；不要空洞的眼神，不要舞台腔，不要过度表演；脸部清晰。本段结束时：周岸上前半步，右手搭在夹克口袋外；视线：周岸面向画面左；林小满背对镜头\n0-5秒：全景，侧 45 度，平视，跟拍，手持晃动，35mm，深景深。林小满小跑到走廊尽头，电梯门正在合上，一只手从里面把门挡住。周岸从电梯里走出来，病号服外套着黑夹克，拖鞋踩在地板上。表演：① 她刹住脚时病历夹差点掉；② 周岸出电梯的第一步很稳，第二步才看见她。光来自头顶闪烁的日光灯，顶光忽明忽暗；电梯指示灯红光在他侧脸。主光：头顶闪烁的日光灯，顶光直落；辅光：浅绿塑胶地板反射，极弱；轮廓光：电梯指示灯红光勾周岸侧脸；光比：6:1；色温：4500K 冷白；指示灯 1800K 红；阴影：眼窝与鼻下硬影，随闪烁跳动；曝光：脸正常，走廊深处欠两档；光线变化：日光灯每 1 秒闪一次。\n5-8秒：中近景，侧 45 度，平视，过肩，手持微晃，50mm，浅景深。过林小满的肩看周岸。他把手从电梯门上收回来，没有往前走，只是看着她。表演：① 下颌微抬；② 缓慢均匀的一次眨眼；③ 说话前嘴角先松了一下。光来自电梯指示灯，红光在他左颊，顶光闪烁。周岸（音色：低、沉、颗粒感，画内近场；语速：慢半拍；语调：低平陈述；情感：确认而非打招呼；画内）：“小满。”\n8-12秒：（再锚点：人物形象、服装与光源方向与开头一致）近景，侧 45 度，平视，推近，85mm，浅景深。林小满停住，把病历夹抱紧贴到胸口。她的视线先落在他夹克里露出的病号服条纹上，再回到他脸上。表情：0–1.3秒：嘴唇微张，恍惚如在梦中；1.3–2.7秒：涣散目光突然收拢聚焦，睫毛轻颤（台词落在这一段）；2.7–4秒：下巴绷紧，咬唇强行忍住；节拍：① 身体冻住 0.3 秒；② 视线从病号服往上扫到脸；③ 问话前咬了一下下唇内侧。核心词：缓慢地舔嘴唇、饥饿或期待的眼神。光来自头顶闪烁的日光灯，顶光，闪一下她的脸亮一下。林小满（音色：清而薄，略带鼻音，画内近场；语速：快；语调：问句上扬；情感：发紧；画内）：“你是七床？”\n12-16秒：中近景，侧 45 度，微仰，手持微晃，50mm，浅景深。周岸上前半步又停住，右手在夹克口袋外面按了一下，像确认什么东西还在。表演：① 上前半步时重心先动再迈脚；② 按口袋的手指停了一拍；③ 说话时视线没离开她。光来自电梯指示灯，红光在他左颊。周岸（轻，带一点笑意但不是开玩笑）：“我以为你早换科室了。”\n声音：跑步声刹住；电梯门被手挡住的闷响；日光灯镇流器的滋滋声；拖鞋在地板上蹭了一下；不要背景音乐和配乐。\n⚠️人物面部、发型、小特征与服装全程与人物参考一致，不随景别和光线变化。\n⚠️屏幕、灯具只作为画面里发光的物件，不向人物皮肤与服装投射大面积色光。\n约束：人物与参考一致、场景连续、光源方向不变、口型与台词同步、无字幕、无水印、除参考里已有的字外不出现可读文字。\n\n【上传素材，按编号顺序】@图片1 ← 素材库/人物/林小满_特写.png（identity）；@图片2 ← 素材库/人物/周岸_特写.png（identity）；@图片3 ← 素材库/场景/电梯口_夜_空景.png（location）；@图片4 ← 素材库/场景/电梯口_夜_A侧.png（plate）；@图片5 ← 素材库/场景/电梯口_夜_B侧.png（plate）；@音频1 ← 素材库/声音/周岸.wav（voice）；@音频2 ← 素材库/声音/林小满.wav（voice）\n【时长】16 秒"
}